{"artifact_kind":"iotkit-node-backup","format_version":1,"backup_id":"backup-public-vector","edge_node_id":"node-public-vector","ledger_epoch":"epoch-public-vector","created_at_ms":1725000000000,"accepted_cursor":3,"allocation_high_water":5,"snapshot_mode":"online","shutdown_seal_id":null,"schema_version":23,"database_length":25,"database_sha256":"958ec6fc5da916b2f0008194cf46f2e9342ceae562e04e4b035baf5b7339b79c","counts":{"devices":0,"series":0,"readings":0,"publication_rows":0,"ingest_dedup_rows":0,"staged_readings":0,"quarantine_rows":0,"device_principals":0,"device_credentials":0,"activation_rows":0,"ledger_events":0,"audit_events":0}}
